{"decision":"deny","decision_hash":"sha256:5e1194795d037ffa46514095c685323b9b2a25561006e4915f29b1e6b9cab80e","engine":"arbiter.v1","engine_version":"1.0.0","evaluated_at":"2026-04-06T00:17:00.5532300+00:00","input_hash":"sha256:db3e5eca8d1e65fb9b1e97d6d2a07c501083fcbc21724fde67a7c50873b55478","matched_rule_id":"DENY_INVALID_SIGNATURE","obligations":[],"policy_hash":"sha256:d734b68ad7a2351fd3322cf6212bb18747fd72ca47c9575557f351ca0e3de68d","reasons":["DENY_SIG_INVALID"],"schema":"policy.decision.v1"}
