{"decision":"allow","decision_hash":"sha256:70173120845479b97af9337c85824160faaadc2b70a268b03edb9694e2385813","engine":"arbiter.v1","engine_version":"1.0.0","evaluated_at":"2026-04-06T00:17:00.5532300+00:00","input_hash":"sha256:a0f81d6ef6ded1b0fb6dfaab6b7c3c2b2ef7fd3ca1e8c2ad0157873a1ebf07cb","matched_rule_id":"ALLOW_VALID_SIGNATURE","obligations":[],"policy_hash":"sha256:d734b68ad7a2351fd3322cf6212bb18747fd72ca47c9575557f351ca0e3de68d","reasons":["ALLOW_SIG_VALID"],"schema":"policy.decision.v1"}
